{
  "schema_version": "1.0.0",
  "event_id": "018f6d43-7f2b-7c6a-8f31-a8d984427001",
  "correlation_id": "75dbeb03-bede-418a-aaf8-b58b4f1a6a71",
  "source": {
    "provider": "fixture_wire",
    "news_id": "wire-2026-0001",
    "revision_id": "rev-0001",
    "canonical_url": "https://news.example.test/articles/wire-2026-0001"
  },
  "source_created_at": "2026-01-15T14:30:00Z",
  "source_updated_at": "2026-01-15T14:31:00Z",
  "received_at": "2026-01-15T14:31:03Z",
  "deadline_at": "2026-01-15T14:36:03Z",
  "content_hash": "3a7bd3e2360a3d80b44b62d5c6d1c9d346e8f7194edcf0f34f3f30f8fd2f2f19",
  "headline": "ACME reports second-quarter earnings",
  "content": {
    "language": "en-US",
    "summary": "ACME reported second-quarter earnings and revenue."
  },
  "affected_symbols": [
    "ACME"
  ]
}
