{
  "schema_version": "1.0.0",
  "event_id": "6ab60b5e-9999-44b8-8d9b-e53f21ed0d07",
  "correlation_id": "d7d06d8f-6064-46a0-85bb-38ae4c2c228d",
  "causation_id": "75dbeb03-bede-418a-aaf8-b58b4f1a6a71",
  "source": {
    "provider": "fixture_filings",
    "news_id": "filing-2026-0042",
    "revision_id": "amendment-2",
    "canonical_url": "https://filings.example.test/filing-2026-0042"
  },
  "source_created_at": "2026-01-16T08:55:00Z",
  "source_updated_at": "2026-01-16T08:58:00Z",
  "received_at": "2026-01-16T08:58:04Z",
  "deadline_at": "2026-01-16T09:03:04Z",
  "content_hash": "cccccccccccccccccccccccccccccccccccccccccccccccccccccccccccccccc",
  "headline": "ACME agrees to acquire BETA",
  "content": {
    "language": "en",
    "summary": "ACME announced an agreement to acquire BETA.",
    "body": "The fixed fixture body identifies ACME as acquirer and BETA as counterparty."
  },
  "affected_symbols": [
    "ACME",
    "BETA"
  ]
}
